{
  "schema": "tradecat_auto.agent_trade_thesis.v1",
  "schema_version": "1.0.0",
  "ok": true,
  "thesis_id": "example-btc-long-001",
  "symbol": "BTCUSDT",
  "mode": "paper_research",
  "direction": "LONG",
  "confidence": 0.62,
  "holding_horizon": "intraday",
  "rationale": "Example thesis for tradeagnt V2 harness validation only.",
  "risk_notes": ["Demo payload — not investment advice."],
  "invalidation_price": 95000.0,
  "take_profit_price": 105000.0,
  "max_holding_minutes": 240,
  "paper_intent": {
    "requested_margin_usdt": 100.0,
    "paper_leverage": 2.0,
    "real_order": false
  },
  "provenance": {
    "source": "tradeagnt.docs.examples",
    "agent": "prd-smoke"
  },
  "safety": {
    "public_readonly_market_data": true,
    "public_readonly": true,
    "paper_or_watch_only": true,
    "real_orders": false,
    "signed_requests": false,
    "reads_api_keys": false,
    "binance_account_state": false
  },
  "limitations": ["Synthetic example for AC-02; submit may still fail until M2."]
}
